EWO,Data_de_abertura,Hora_de_abertura,Maquina,Problema,TTR_min,Descricao_Intervencao
000200758802,2022-04-05,05:14,D,"*OP* 05*DESCRIÇÃO* Robô 05R01 depositou o montante central M598 fora do pallet*INÍCIO* 04:20*FINAL* 04:50*TOTAL* 30 minutos*RESPONSÁ VEL* Evandro RB,Vicente SW,Edmilson,,Jailson",60.0,foi verificado que a peça em questão foi carrega no tubular já amassada sendo necessário remove-la de produção como refugo e reiniciado o ciclo com a mesma sequencia de produção da peça que estava danificada em seguida foi visto que poderia ocorrer o mesmo problema então foi necessário corrigir a pega do robô 005R01 e a linha foi liberada 100% sem recorrência
000200758834,2022-04-05,05:19,A,*OFS**EWO* PROVIDENCIANDO*Descrição:* OP 05Transporte aéreo APC - Robô 05r01 queda da peça (598) no momento do depósito no pallet*So lução:* foi colocado o Robô em home e recolocado os dados da peça na lista (598)*Início:* 03:05:00*Final:* 03:17:00*Total:* 12 minut os*Responsável:* Vicente SW - Evandro RB. - Edmilson,24.0,"foi verificado que o robô derrubou a peça durante deposito no transporte devido a peça esta empenada e com amassado vindo do tubular de carregamento na baia, sendo necessário voltar a sequencia danificada para lista da OP005 liberando a linha após colocar o robô no ciclo inicial."
000200759171,2022-04-08,04:39,C,"Robo 15R01 em falha na abertura do gripper durante a pega da ferramenta no Tool ChangerInicio: 3:58Fim: 4:26Manutentores: Edmilson (Assist. Mec.), Ronaldo (Assist. Robo), leo (Assist. Soft.) e Ismael (Eletr.)",56.0,"Após me informar do ocorrido com Robotista e mecânico da assistência, percebemos que o havia um vazamento na mangueira pneumática do da sequencia 2 e 3 do gripper, logo, foi necessário colocar gripper em posição acessível, substituir mangueira com vazamento e restabelecer ciclo da linha.

Obs.: Quem estava atuando nessa falha foi assistência (Edmilson, Ronaldo, Leo). Cheguei na linha nos últimos 5 minutos antes da conclusão.  "
000200759313,2022-04-09,00:24,G,"02R01 aguardando sinal 383 , robô 02R01 travando a pega do 02R02 , mesa T06 aguardando sinal do 02R01 em em falha de time out .   in ício : 19:25  final :20:19  manutenção : nilson",108.0,"robô 02R01 travando a pega do 02R02 , mesa T06 aguardando sinal do 02R01. Foi dado fim de trabalho na mesa T06 com peças na linha e fez com que a mesma saisse do passo. Foi realizado o zeramento das peças das mesas e dos robôs, para colocá-la no passo."
000200761281,2022-04-29,04:41,I,Robo 15R01 fora do ciclo.Inicio:03:33Fim:03:58Tempo total: 25 min.Manutentor: Thiago/ Leo / Ismael,50.0,"Ao chegar percebemos que o Robo 15R01 não partiu devido incongruência entre as listas, motivado por erro operacional na criação da lista. Com auxilio do robotista foi restabelecido ciclo da linha e corrigido lista PRG no nivel 1,5.

Obs.: Quado chegamos na linha percebemos que o PC de linha estava queimado, logo, foi necessário usar Simatic Field PG. O mesmo não estava com programa Gestione Ordini e supervisório configurado pra linha PLCS, sendo necessário corrigir todas as falhas pelo PLC."
000200765566,2022-06-14,05:46,E,"Durante a troca do modelo 521 para 551, no depósito o gripper empenou e quebrou a chaveta.Início: 04:40Final: 05:05Responsável: Evandro (Assist. Robo), Marlon (Elet.), Ismael	Total: 25 min",50.0,"Foi necessário retirar Robo 15R02 em manual, ajustar posicionamento do interruptor de segurança e restabelecer ciclo da linha.

Obs.: Cheguei na linha as 04:55 (simultaneamente com Assist. Robo e Elétrica), porém a linha já estava parada antes disso (desde as 04:40 hrs). Logo a interveção da manutenção durou aproximadamente entre 04:55 hrs e 05:05 hrs."
000200767831,2022-07-20,21:12,B,"Linha: OFS op.60Hora inicial: 18:01Manutenção Responsável: RONALDO, TALLES, JONAS, FÁBIO, LUIZ.Descrição:ROBO 60R05 GRIPPER 2 NAO CO NECTADO/MÓDULO DE VÁLVULA EM FALHA.Solução: Troca do bloco de válvulaHora Final: 19:20Tempo total: 79 minutos",632.0,roca do bloco de válvula